{
  "schemaVersion": 2,
  "provider": "anthropic",
  "model": "claude-sonnet-4-6",
  "phase": "read-only",
  "suiteVersion": "v1",
  "certifiedAt": "2026-06-01T00:00:00.000Z",
  "scenarios": [
    { "scenarioId": "list-files", "passed": true },
    { "scenarioId": "read-file", "passed": true, "retryCount": 0 }
  ],
  "knownLimitations": [],
  "totalRetryCount": 0
}
