{
  "schemaVersion": 2,
  "provider": "anthropic",
  "model": "claude-sonnet-4-6",
  "phase": "patch",
  "suiteVersion": "v1",
  "certifiedAt": "2026-06-01T00:00:00.000Z",
  "scenarios": [
    { "scenarioId": "list-files", "passed": true },
    { "scenarioId": "read-file", "passed": true },
    { "scenarioId": "apply-patch", "passed": true, "retryCount": 1 }
  ],
  "totalRetryCount": 1
}
